{"checks":["strict_counterfactual_report_and_embedded_score_reparsed","canonical_score_binding_recomputed","twenty_semantic_dimension_vectors_independently_derived","twenty_valid_control_and_denial_mutant_pairs_reconstructed","changed_and_expected_dimension_sets_compared_exactly","gateway_score_and_all_guard_pair_pass_conjunction_recomputed"],"document":{"document_sha256":"9e19c40860a85ac7f82f75639b4589867fc9001c4ddb0823e68a29fa6f9cef9c","payload_base64":"eyJldmFsdWF0ZWRfYXQiOiIyMDI2LTA5LTA1VDE1OjA2OjAwWiIsImxpbWl0YXRpb25zIjpbInBhaXJzX21lYXN1cmVfZGVjbGFyZWRfc2VtYW50aWNfZGltZW5zaW9uc19ub3Rfc291cmNlX2NvZGVfY29uZGl0aW9uc19vcl9mb3JtYWxfbWNkYyIsImFwcHJvdmFsX2NvdW50X2FuZF9yZXBsYXlfcGFpcnNfcmVxdWlyZV9tdWx0aXBsZV9jaGFuZ2VkX2RpbWVuc2lvbnNfZHVlX3RvX2NvbnRyYWN0X2RlcGVuZGVuY2llcyIsInJlZmVyZW5jZV9zdWJtaXNzaW9uX3Rlc3RzX3RoZV9yZWZlcmVuY2Vfc2VtYW50aWNzX25vdF9hbl9leHRlcm5hbF9nYXRld2F5IiwicGFzc2luZ19kb2VzX25vdF9lc3RhYmxpc2hfdW5yZXByZXNlbnRlZF92YWx1ZXNfaW50ZXJhY3Rpb25zX3NlcXVlbmNlc19vcl9jb21wbGV0ZV9tZWRpYXRpb24iLCJwYXNzaW5nX2lzX25vdF9jb21wbGlhbmNlX2NlcnRpZmljYXRpb25fc2FmZXR5X2xlZ2FsX2F1dGhvcml0eV9vcl9kZXBsb3ltZW50X2F1dGhvcml6YXRpb24iXSwibWV0aG9kIjp7ImRpbWVuc2lvbl9pZHMiOlsicG9saWN5X2JpbmRpbmciLCJ0ZW5hbnRfYmluZGluZyIsInJ1bl9iaW5kaW5nIiwiYWdlbnRfaWRlbnRpdHlfYmluZGluZyIsImFnZW50X3BvbGljeV9hc3NpZ25tZW50IiwicmVxdWVzdGVyX3JlZ2lzdHJ5X21lbWJlcnNoaXAiLCJpbXBhY3Rfd2l0aGluX2xpbWl0IiwiYXBwcm92YWxfY291bnRfc3VmZmljaWVudCIsIm1pc3Npb25fYXBwcm92YWxfZnJlc2giLCJtaXNzaW9uX2ludGVudF9iaW5kaW5nIiwibWlzc2lvbl9kZWNpc2lvbl9hcHByb3ZlIiwicmVxdWVzdGVyX3NlcGFyYXRpb24iLCJtaXNzaW9uX2FwcHJvdmVyX3JlZ2lzdHJ5X21lbWJlcnNoaXAiLCJtaXNzaW9uX3JvbGVfYXNzaWdubWVudCIsIm1pc3Npb25fbm90X2JlZm9yZV9pbnRlbnQiLCJtaXNzaW9uX25vdF9hZnRlcl9kZWNpc2lvbiIsIm1pc3Npb25fdW5leHBpcmVkX2F0X2RlY2lzaW9uIiwibWlzc2lvbl90dGxfd2l0aGluX3BvbGljeSIsInJlcXVpcmVkX3NlY3VyaXR5X3JvbGUiLCJjdW11bGF0aXZlX2J1ZGdldF9hdmFpbGFibGUiXSwiZ3VhcmRfcmVhc29ucyI6WyJwb2xpY3lfdW5rbm93biIsInRlbmFudF9taXNtYXRjaCIsInJ1bl9iaW5kaW5nX21pc21hdGNoIiwiYWdlbnRfaWRlbnRpdHlfbWlzbWF0Y2giLCJhZ2VudF9wb2xpY3lfZGVuaWVkIiwicmVxdWVzdGVyX3Vua25vd24iLCJpbXBhY3RfbGltaXRfZXhjZWVkZWQiLCJhcHByb3ZhbF9jb3VudF9pbnN1ZmZpY2llbnQiLCJhcHByb3ZhbF9iaW5kaW5nX21pc21hdGNoIiwiYXBwcm92YWxfZGVuaWVkIiwic2VsZl9hcHByb3ZhbCIsImFwcHJvdmVyX3Vua25vd24iLCJhcHByb3Zlcl9yb2xlX3VuYXV0aG9yaXplZCIsImFwcHJvdmFsX3ByZWRhdGVzX2ludGVudCIsImFwcHJvdmFsX2FmdGVyX2RlY2lzaW9uIiwiYXBwcm92YWxfZXhwaXJlZCIsImFwcHJvdmFsX3dpbmRvd19pbnZhbGlkIiwicmVxdWlyZWRfcm9sZV9taXNzaW5nIiwiYXBwcm92YWxfcmVwbGF5IiwiY3VtdWxhdGl2ZV9saW1pdF9leGNlZWRlZCJdLCJuYW1lIjoiYWRqYWNlbnQtdmFsaWQtY29udHJvbC1ndWFyZC1wYWlycyJ9LCJwYWlycyI6W3siYmFzZWxpbmVfY2FzZV9pZCI6ImNhc2UtMDAwMSIsImJhc2VsaW5lX2V4cGVjdGVkX2RlY2lzaW9uIjoiYWxsb3ciLCJiYXNlbGluZV9zdWJtaXR0ZWRfZGVjaXNpb24iOiJhbGxvdyIsImNoYW5nZWRfZGltZW5zaW9ucyI6WyJwb2xpY3lfYmluZGluZyJdLCJleHBlY3RlZF9jaGFuZ2VkX2RpbWVuc2lvbnMiOlsicG9saWN5X2JpbmRpbmciXSwiZ3VhcmRfcmVhc29uIjoicG9saWN5X3Vua25vd24iLCJtdXRhbnRfY2FzZV9pZCI6ImNhc2UtMDAwMiIsIm11dGFudF9leHBlY3RlZF9kZWNpc2lvbiI6ImJsb2NrIiwibXV0YW50X3N1Ym1pdHRlZF9kZWNpc2lvbiI6ImJsb2NrIiwicGFpcl9pZCI6Imd1YXJkLXBhaXItMDEiLCJzdGF0dXMiOiJwYXNzIn0seyJiYXNlbGluZV9jYXNlX2lkIjoiY2FzZS0wMDAzIiwiYmFzZWxpbmVfZXhwZWN0ZWRfZGVjaXNpb24iOiJhbGxvdyIsImJhc2VsaW5lX3N1Ym1pdHRlZF9kZWNpc2lvbiI6ImFsbG93IiwiY2hhbmdlZF9kaW1lbnNpb25zIjpbInRlbmFudF9iaW5kaW5nIl0sImV4cGVjdGVkX2NoYW5nZWRfZGltZW5zaW9ucyI6WyJ0ZW5hbnRfYmluZGluZyJdLCJndWFyZF9yZWFzb24iOiJ0ZW5hbnRfbWlzbWF0Y2giLCJtdXRhbnRfY2FzZV9pZCI6ImNhc2UtMDAwNCIsIm11dGFudF9leHBlY3RlZF9kZWNpc2lvbiI6ImJsb2NrIiwibXV0YW50X3N1Ym1pdHRlZF9kZWNpc2lvbiI6ImJsb2NrIiwicGFpcl9pZCI6Imd1YXJkLXBhaXItMDIiLCJzdGF0dXMiOiJwYXNzIn0seyJiYXNlbGluZV9jYXNlX2lkIjoiY2FzZS0wMDA1IiwiYmFzZWxpbmVfZXhwZWN0ZWRfZGVjaXNpb24iOiJhbGxvdyIsImJhc2VsaW5lX3N1Ym1pdHRlZF9kZWNpc2lvbiI6ImFsbG93IiwiY2hhbmdlZF9kaW1lbnNpb25zIjpbInJ1bl9iaW5kaW5nIl0sImV4cGVjdGVkX2NoYW5nZWRfZGltZW5zaW9ucyI6WyJydW5fYmluZGluZyJdLCJndWFyZF9yZWFzb24iOiJydW5fYmluZGluZ19taXNtYXRjaCIsIm11dGFudF9jYXNlX2lkIjoiY2FzZS0wMDA2IiwibXV0YW50X2V4cGVjdGVkX2RlY2lzaW9uIjoiYmxvY2siLCJtdXRhbnRfc3VibWl0dGVkX2RlY2lzaW9uIjoiYmxvY2siLCJwYWlyX2lkIjoiZ3VhcmQtcGFpci0wMyIsInN0YXR1cyI6InBhc3MifSx7ImJhc2VsaW5lX2Nhc2VfaWQiOiJjYXNlLTAwMDciLCJiYXNlbGluZV9leHBlY3RlZF9kZWNpc2lvbiI6ImFsbG93IiwiYmFzZWxpbmVfc3VibWl0dGVkX2RlY2lzaW9uIjoiYWxsb3ciLCJjaGFuZ2VkX2RpbWVuc2lvbnMiOlsiYWdlbnRfaWRlbnRpdHlfYmluZGluZyJdLCJleHBlY3RlZF9jaGFuZ2VkX2RpbWVuc2lvbnMiOlsiYWdlbnRfaWRlbnRpdHlfYmluZGluZyJdLCJndWFyZF9yZWFzb24iOiJhZ2VudF9pZGVudGl0eV9taXNtYXRjaCIsIm11dGFudF9jYXNlX2lkIjoiY2FzZS0wMDA4IiwibXV0YW50X2V4cGVjdGVkX2RlY2lzaW9uIjoiYmxvY2siLCJtdXRhbnRfc3VibWl0dGVkX2RlY2lzaW9uIjoiYmxvY2siLCJwYWlyX2lkIjoiZ3VhcmQtcGFpci0wNCIsInN0YXR1cyI6InBhc3MifSx7ImJhc2VsaW5lX2Nhc2VfaWQiOiJjYXNlLTAwMDkiLCJiYXNlbGluZV9leHBlY3RlZF9kZWNpc2lvbiI6ImFsbG93IiwiYmFzZWxpbmVfc3VibWl0dGVkX2RlY2lzaW9uIjoiYWxsb3ciLCJjaGFuZ2VkX2RpbWVuc2lvbnMiOlsiYWdlbnRfcG9saWN5X2Fzc2lnbm1lbnQiXSwiZXhwZWN0ZWRfY2hhbmdlZF9kaW1lbnNpb25zIjpbImFnZW50X3BvbGljeV9hc3NpZ25tZW50Il0sImd1YXJkX3JlYXNvbiI6ImFnZW50X3BvbGljeV9kZW5pZWQiLCJtdXRhbnRfY2FzZV9pZCI6ImNhc2UtMDAxMCIsIm11dGFudF9leHBlY3RlZF9kZWNpc2lvbiI6ImJsb2NrIiwibXV0YW50X3N1Ym1pdHRlZF9kZWNpc2lvbiI6ImJsb2NrIiwicGFpcl9pZCI6Imd1YXJkLXBhaXItMDUiLCJzdGF0dXMiOiJwYXNzIn0seyJiYXNlbGluZV9jYXNlX2lkIjoiY2FzZS0wMDExIiwiYmFzZWxpbmVfZXhwZWN0ZWRfZGVjaXNpb24iOiJhbGxvdyIsImJhc2VsaW5lX3N1Ym1pdHRlZF9kZWNpc2lvbiI6ImFsbG93IiwiY2hhbmdlZF9kaW1lbnNpb25zIjpbInJlcXVlc3Rlcl9yZWdpc3RyeV9tZW1iZXJzaGlwIl0sImV4cGVjdGVkX2NoYW5nZWRfZGltZW5zaW9ucyI6WyJyZXF1ZXN0ZXJfcmVnaXN0cnlfbWVtYmVyc2hpcCJdLCJndWFyZF9yZWFzb24iOiJyZXF1ZXN0ZXJfdW5rbm93biIsIm11dGFudF9jYXNlX2lkIjoiY2FzZS0wMDEyIiwibXV0YW50X2V4cGVjdGVkX2RlY2lzaW9uIjoiYmxvY2siLCJtdXRhbnRfc3VibWl0dGVkX2RlY2lzaW9uIjoiYmxvY2siLCJwYWlyX2lkIjoiZ3VhcmQtcGFpci0wNiIsInN0YXR1cyI6InBhc3MifSx7ImJhc2VsaW5lX2Nhc2VfaWQiOiJjYXNlLTAwMTMiLCJiYXNlbGluZV9leHBlY3RlZF9kZWNpc2lvbiI6ImFsbG93IiwiYmFzZWxpbmVfc3VibWl0dGVkX2RlY2lzaW9uIjoiYWxsb3ciLCJjaGFuZ2VkX2RpbWVuc2lvbnMiOlsiaW1wYWN0X3dpdGhpbl9saW1pdCJdLCJleHBlY3RlZF9jaGFuZ2VkX2RpbWVuc2lvbnMiOlsiaW1wYWN0X3dpdGhpbl9saW1pdCJdLCJndWFyZF9yZWFzb24iOiJpbXBhY3RfbGltaXRfZXhjZWVkZWQiLCJtdXRhbnRfY2FzZV9pZCI6ImNhc2UtMDAxNCIsIm11dGFudF9leHBlY3RlZF9kZWNpc2lvbiI6ImJsb2NrIiwibXV0YW50X3N1Ym1pdHRlZF9kZWNpc2lvbiI6ImJsb2NrIiwicGFpcl9pZCI6Imd1YXJkLXBhaXItMDciLCJzdGF0dXMiOiJwYXNzIn0seyJiYXNlbGluZV9jYXNlX2lkIjoiY2FzZS0wMDE1IiwiYmFzZWxpbmVfZXhwZWN0ZWRfZGVjaXNpb24iOiJhbGxvdyIsImJhc2VsaW5lX3N1Ym1pdHRlZF9kZWNpc2lvbiI6ImFsbG93IiwiY2hhbmdlZF9kaW1lbnNpb25zIjpbImFwcHJvdmFsX2NvdW50X3N1ZmZpY2llbnQiLCJyZXF1aXJlZF9zZWN1cml0eV9yb2xlIl0sImV4cGVjdGVkX2NoYW5nZWRfZGltZW5zaW9ucyI6WyJhcHByb3ZhbF9jb3VudF9zdWZmaWNpZW50IiwicmVxdWlyZWRfc2VjdXJpdHlfcm9sZSJdLCJndWFyZF9yZWFzb24iOiJhcHByb3ZhbF9jb3VudF9pbnN1ZmZpY2llbnQiLCJtdXRhbnRfY2FzZV9pZCI6ImNhc2UtMDAxNiIsIm11dGFudF9leHBlY3RlZF9kZWNpc2lvbiI6ImJsb2NrIiwibXV0YW50X3N1Ym1pdHRlZF9kZWNpc2lvbiI6ImJsb2NrIiwicGFpcl9pZCI6Imd1YXJkLXBhaXItMDgiLCJzdGF0dXMiOiJwYXNzIn0seyJiYXNlbGluZV9jYXNlX2lkIjoiY2FzZS0wMDE3IiwiYmFzZWxpbmVfZXhwZWN0ZWRfZGVjaXNpb24iOiJhbGxvdyIsImJhc2VsaW5lX3N1Ym1pdHRlZF9kZWNpc2lvbiI6ImFsbG93IiwiY2hhbmdlZF9kaW1lbnNpb25zIjpbIm1pc3Npb25faW50ZW50X2JpbmRpbmciXSwiZXhwZWN0ZWRfY2hhbmdlZF9kaW1lbnNpb25zIjpbIm1pc3Npb25faW50ZW50X2JpbmRpbmciXSwiZ3VhcmRfcmVhc29uIjoiYXBwcm92YWxfYmluZGluZ19taXNtYXRjaCIsIm11dGFudF9jYXNlX2lkIjoiY2FzZS0wMDE4IiwibXV0YW50X2V4cGVjdGVkX2RlY2lzaW9uIjoiYmxvY2siLCJtdXRhbnRfc3VibWl0dGVkX2RlY2lzaW9uIjoiYmxvY2siLCJwYWlyX2lkIjoiZ3VhcmQtcGFpci0wOSIsInN0YXR1cyI6InBhc3MifSx7ImJhc2VsaW5lX2Nhc2VfaWQiOiJjYXNlLTAwMTkiLCJiYXNlbGluZV9leHBlY3RlZF9kZWNpc2lvbiI6ImFsbG93IiwiYmFzZWxpbmVfc3VibWl0dGVkX2RlY2lzaW9uIjoiYWxsb3ciLCJjaGFuZ2VkX2RpbWVuc2lvbnMiOlsibWlzc2lvbl9kZWNpc2lvbl9hcHByb3ZlIl0sImV4cGVjdGVkX2NoYW5nZWRfZGltZW5zaW9ucyI6WyJtaXNzaW9uX2RlY2lzaW9uX2FwcHJvdmUiXSwiZ3VhcmRfcmVhc29uIjoiYXBwcm92YWxfZGVuaWVkIiwibXV0YW50X2Nhc2VfaWQiOiJjYXNlLTAwMjAiLCJtdXRhbnRfZXhwZWN0ZWRfZGVjaXNpb24iOiJibG9jayIsIm11dGFudF9zdWJtaXR0ZWRfZGVjaXNpb24iOiJibG9jayIsInBhaXJfaWQiOiJndWFyZC1wYWlyLTEwIiwic3RhdHVzIjoicGFzcyJ9LHsiYmFzZWxpbmVfY2FzZV9pZCI6ImNhc2UtMDAyMSIsImJhc2VsaW5lX2V4cGVjdGVkX2RlY2lzaW9uIjoiYWxsb3ciLCJiYXNlbGluZV9zdWJtaXR0ZWRfZGVjaXNpb24iOiJhbGxvdyIsImNoYW5nZWRfZGltZW5zaW9ucyI6WyJyZXF1ZXN0ZXJfc2VwYXJhdGlvbiJdLCJleHBlY3RlZF9jaGFuZ2VkX2RpbWVuc2lvbnMiOlsicmVxdWVzdGVyX3NlcGFyYXRpb24iXSwiZ3VhcmRfcmVhc29uIjoic2VsZl9hcHByb3ZhbCIsIm11dGFudF9jYXNlX2lkIjoiY2FzZS0wMDIyIiwibXV0YW50X2V4cGVjdGVkX2RlY2lzaW9uIjoiYmxvY2siLCJtdXRhbnRfc3VibWl0dGVkX2RlY2lzaW9uIjoiYmxvY2siLCJwYWlyX2lkIjoiZ3VhcmQtcGFpci0xMSIsInN0YXR1cyI6InBhc3MifSx7ImJhc2VsaW5lX2Nhc2VfaWQiOiJjYXNlLTAwMjMiLCJiYXNlbGluZV9leHBlY3RlZF9kZWNpc2lvbiI6ImFsbG93IiwiYmFzZWxpbmVfc3VibWl0dGVkX2RlY2lzaW9uIjoiYWxsb3ciLCJjaGFuZ2VkX2RpbWVuc2lvbnMiOlsibWlzc2lvbl9hcHByb3Zlcl9yZWdpc3RyeV9tZW1iZXJzaGlwIl0sImV4cGVjdGVkX2NoYW5nZWRfZGltZW5zaW9ucyI6WyJtaXNzaW9uX2FwcHJvdmVyX3JlZ2lzdHJ5X21lbWJlcnNoaXAiXSwiZ3VhcmRfcmVhc29uIjoiYXBwcm92ZXJfdW5rbm93biIsIm11dGFudF9jYXNlX2lkIjoiY2FzZS0wMDI0IiwibXV0YW50X2V4cGVjdGVkX2RlY2lzaW9uIjoiYmxvY2siLCJtdXRhbnRfc3VibWl0dGVkX2RlY2lzaW9uIjoiYmxvY2siLCJwYWlyX2lkIjoiZ3VhcmQtcGFpci0xMiIsInN0YXR1cyI6InBhc3MifSx7ImJhc2VsaW5lX2Nhc2VfaWQiOiJjYXNlLTAwMjUiLCJiYXNlbGluZV9leHBlY3RlZF9kZWNpc2lvbiI6ImFsbG93IiwiYmFzZWxpbmVfc3VibWl0dGVkX2RlY2lzaW9uIjoiYWxsb3ciLCJjaGFuZ2VkX2RpbWVuc2lvbnMiOlsibWlzc2lvbl9yb2xlX2Fzc2lnbm1lbnQiXSwiZXhwZWN0ZWRfY2hhbmdlZF9kaW1lbnNpb25zIjpbIm1pc3Npb25fcm9sZV9hc3NpZ25tZW50Il0sImd1YXJkX3JlYXNvbiI6ImFwcHJvdmVyX3JvbGVfdW5hdXRob3JpemVkIiwibXV0YW50X2Nhc2VfaWQiOiJjYXNlLTAwMjYiLCJtdXRhbnRfZXhwZWN0ZWRfZGVjaXNpb24iOiJibG9jayIsIm11dGFudF9zdWJtaXR0ZWRfZGVjaXNpb24iOiJibG9jayIsInBhaXJfaWQiOiJndWFyZC1wYWlyLTEzIiwic3RhdHVzIjoicGFzcyJ9LHsiYmFzZWxpbmVfY2FzZV9pZCI6ImNhc2UtMDAyNyIsImJhc2VsaW5lX2V4cGVjdGVkX2RlY2lzaW9uIjoiYWxsb3ciLCJiYXNlbGluZV9zdWJtaXR0ZWRfZGVjaXNpb24iOiJhbGxvdyIsImNoYW5nZWRfZGltZW5zaW9ucyI6WyJtaXNzaW9uX25vdF9iZWZvcmVfaW50ZW50Il0sImV4cGVjdGVkX2NoYW5nZWRfZGltZW5zaW9ucyI6WyJtaXNzaW9uX25vdF9iZWZvcmVfaW50ZW50Il0sImd1YXJkX3JlYXNvbiI6ImFwcHJvdmFsX3ByZWRhdGVzX2ludGVudCIsIm11dGFudF9jYXNlX2lkIjoiY2FzZS0wMDI4IiwibXV0YW50X2V4cGVjdGVkX2RlY2lzaW9uIjoiYmxvY2siLCJtdXRhbnRfc3VibWl0dGVkX2RlY2lzaW9uIjoiYmxvY2siLCJwYWlyX2lkIjoiZ3VhcmQtcGFpci0xNCIsInN0YXR1cyI6InBhc3MifSx7ImJhc2VsaW5lX2Nhc2VfaWQiOiJjYXNlLTAw